{
  "$schema": "./schema/scene-schema.json",
  "camera": {
    "position": [0, 0, 0],
    "lookAt": [0, 0, -1],
    "up": [0, 1, 0],
    "fov": 60,
    "aspectRatio": 0.5273,
    "near": 0.1,
    "far": 400
  },
  "materials": {
    "orchidMetal": {
      "base": "METAL",
      "ambient": 0.03,
      "diffuse": 0.4,
      "specular": 0.75,
      "shininess": 70,
      "reflectivity": 0.15
    }
  },
  "models": [
    {
      "path": "src/Raytracer/Models/Orchid.obj",
      "position": [-0.4, -1.3, -2],
      "scale": [0.1, 0.1, 0.1],
      "rotation": [-30, -45, 0],
      "color": [0.92, 0.9, 0.85],
      "material": "orchidMetal",
      "texture": "src/Raytracer/Textures/Orchid.jpg"
    },
    {
      "path": "src/Raytracer/Models/Orchid.obj",
      "position": [0, -0.7, -2],
      "scale": [0.1, 0.1, 0.1],
      "rotation": [-30, 5, -25],
      "color": [0.92, 0.9, 0.85],
      "material": "orchidMetal",
      "texture": "src/Raytracer/Textures/Orchid.jpg"
    },
    {
      "path": "src/Raytracer/Models/Orchid.obj",
      "position": [-0.3, -0.25, -2.05],
      "scale": [0.1, 0.1, 0.1],
      "rotation": [-20, 25, -40],
      "color": [0.92, 0.9, 0.85],
      "material": "orchidMetal",
      "texture": "src/Raytracer/Textures/Orchid.jpg"
    },
    {
      "path": "src/Raytracer/Models/Orchid.obj",
      "position": [0, 0.35, -2.2],
      "scale": [0.1, 0.1, 0.1],
      "rotation": [-45, 15, 60],
      "color": [0.92, 0.9, 0.85],
      "material": "orchidMetal",
      "texture": "src/Raytracer/Textures/Orchid.jpg"
    },
    {
      "path": "src/Raytracer/Models/Orchid.obj",
      "position": [0, 0.4, -2.2],
      "scale": [0.085, 0.085, 0.085],
      "rotation": [-10, -20, -25],
      "color": [0.92, 0.9, 0.85],
      "material": "orchidMetal",
      "texture": "src/Raytracer/Textures/Orchid.jpg"
    }
  ],
  "lights": [
    {
      "type": "spot",
      "position": [-1, 5.5, -0.5],
      "direction": [0.3, -1, -0.3],
      "color": [0.3, 0.25, 0.9],
      "intensity": 48,
      "innerAngle": 22,
      "outerAngle": 38
    },
    {
      "type": "spot",
      "position": [0, -4.5, -0.5],
      "direction": [0, 1, -0.5],
      "color": [0.85, 0.1, 0.1],
      "intensity": 14,
      "innerAngle": 20,
      "outerAngle": 35
    },
    {
      "type": "point",
      "position": [3.5, 1, -2],
      "color": [0.7, 0.1, 0.1],
      "intensity": 4
    },
    {
      "type": "point",
      "position": [0, 0, 2],
      "color": [0.25, 0.23, 0.25],
      "intensity": 0.5
    }
  ],
  "render": {
    "width": 2160,
    "height": 4096,
    "aaSamples": 4,
    "output": "output.png"
  }
}